{
  "id": "brief-2026-06-19",
  "periodStart": "2026-06-13",
  "periodEnd": "2026-06-19",
  "signalIds": [
    "sig-2026-02-10-zebra-alpha",
    "sig-2026-02-10-zebra-beta",
    "sig-2026-03-04-zebra-gamma",
    "sig-2026-05-20-zebra-delta",
    "sig-2026-06-15-zebra-epsilon"
  ],
  "label": "frozen",
  "provenance": {
    "sourceUrl": null,
    "publisher": null,
    "publishedOn": null,
    "retrievedOn": null,
    "producedBy": [
      "brief-editor"
    ],
    "producedOn": "2026-10-04",
    "frozenOn": "2026-10-05"
  }
}
