{
  "id": "brief-2026-09-30",
  "periodStart": "2026-07-01",
  "periodEnd": "2026-09-30",
  "signalIds": [
    "sig-2026-09-22-new-relic-observability-forecast",
    "sig-2026-09-22-otel-prometheus-interoperability-survey",
    "sig-2026-09-18-splunk-agent-observability",
    "sig-2026-09-08-austria-nis2-implementation-starts",
    "sig-2026-09-07-dash0-signalcontrol"
  ],
  "label": "frozen",
  "provenance": {
    "sourceUrl": null,
    "publisher": null,
    "publishedOn": null,
    "retrievedOn": null,
    "producedBy": [
      "brief-editor"
    ],
    "producedOn": "2026-10-06",
    "frozenOn": "2026-10-06"
  }
}
